{"decision": {"change": "target_analysis", "component": "orchestration", "gain_pct": null, "kind": "other", "operation_kind": "other", "outcome": "KEEP", "task_id": "6d85470303c24de3a6c31ebe216ab7a4"}, "phase": "PRELUDE", "tick": 1, "tokens": {"by_component": {}, "calls": 0, "total_cache": 0, "total_in": 0, "total_out": 0, "total_reasoning_out": 0}, "ts": "2026-09-15T16:19:25Z"}
{"decision": {"change": "baseline", "component": "orchestration", "gain_pct": null, "kind": "baseline", "operation_kind": "baseline", "outcome": "REVERT", "task_id": "f9f5f7ae4c424c41a09527ad7d95993c"}, "phase": "PRELUDE", "tick": 1, "tokens": {"by_component": {}, "calls": 0, "total_cache": 0, "total_in": 0, "total_out": 0, "total_reasoning_out": 0}, "ts": "2026-09-15T16:19:38Z"}
{"decision": {"change": "specialist", "component": "orchestration", "gain_pct": null, "kind": "other", "operation_kind": "other", "outcome": "KEEP", "task_id": "9d27140cf07749878ef698ad2789b20d"}, "phase": "PRELUDE", "tick": 2, "tokens": {"by_component": {"specialist": {"calls": 98, "total_cache_creation": 0, "total_cache_read": 0, "total_in": 0, "total_out": 192452, "total_reasoning_out": 0}}, "calls": 98, "total_cache": 0, "total_in": 0, "total_out": 192452, "total_reasoning_out": 0}, "ts": "2026-09-15T17:01:28Z"}
{"decision": {"change": "integrate_patch", "component": "orchestration", "gain_pct": null, "kind": "other", "operation_kind": "other", "outcome": "no_promote", "task_id": "684650cc04404308aed3e22cffc3ed0e"}, "phase": "PRELUDE", "tick": 3, "tokens": {"by_component": {"critic": {"calls": 1, "total_cache_creation": 0, "total_cache_read": 0, "total_in": 8037, "total_out": 3016, "total_reasoning_out": 0}}, "calls": 1, "total_cache": 0, "total_in": 8037, "total_out": 3016, "total_reasoning_out": 0}, "ts": "2026-09-15T17:11:37Z"}
{"decision": {"change": "recover", "component": "orchestration", "gain_pct": null, "kind": "other", "operation_kind": "other", "outcome": "KEEP", "task_id": "ca6f8102c6874dc3b961b0b185c40017"}, "phase": "PRELUDE", "tick": 3, "tokens": {"by_component": {}, "calls": 0, "total_cache": 0, "total_in": 0, "total_out": 0, "total_reasoning_out": 0}, "ts": "2026-09-15T17:11:38Z"}
{"decision": {"change": "baseline", "component": "orchestration", "gain_pct": null, "kind": "baseline", "operation_kind": "baseline", "outcome": "REVERT", "task_id": "614857fe763a4e2a821ef61850b1e81e"}, "phase": "PRELUDE", "tick": 4, "tokens": {"by_component": {"critic": {"calls": 1, "total_cache_creation": 0, "total_cache_read": 4800, "total_in": 2982, "total_out": 1822, "total_reasoning_out": 0}}, "calls": 1, "total_cache": 4800, "total_in": 2982, "total_out": 1822, "total_reasoning_out": 0}, "ts": "2026-09-15T17:20:00Z"}
{"decision": {"change": "specialist", "component": "orchestration", "gain_pct": null, "kind": "other", "operation_kind": "other", "outcome": "KEEP", "task_id": "f008270e09ad48e7afc9b262b3aacada"}, "phase": "PRELUDE", "tick": 5, "tokens": {"by_component": {"specialist": {"calls": 35, "total_cache_creation": 0, "total_cache_read": 0, "total_in": 0, "total_out": 0, "total_reasoning_out": 0}}, "calls": 35, "total_cache": 0, "total_in": 0, "total_out": 0, "total_reasoning_out": 0}, "ts": "2026-09-15T17:51:43Z"}
{"decision": {"change": "specialist", "component": "orchestration", "gain_pct": null, "kind": "other", "operation_kind": "other", "outcome": "KEEP", "task_id": "fc07edbde4c9489682f2cafa5a7d253a"}, "phase": "PRELUDE", "tick": 5, "tokens": {"by_component": {"specialist": {"calls": 73, "total_cache_creation": 0, "total_cache_read": 0, "total_in": 0, "total_out": 0, "total_reasoning_out": 0}}, "calls": 73, "total_cache": 0, "total_in": 0, "total_out": 0, "total_reasoning_out": 0}, "ts": "2026-09-15T18:02:54Z"}
{"decision": {"change": "integrate_patch", "component": "orchestration", "gain_pct": null, "kind": "other", "operation_kind": "other", "outcome": "no_promote", "task_id": "a7f420759add4b1c9af14057c2734a8a"}, "phase": "PRELUDE", "tick": 6, "tokens": {"by_component": {"critic": {"calls": 1, "total_cache_creation": 0, "total_cache_read": 0, "total_in": 8175, "total_out": 6169, "total_reasoning_out": 0}}, "calls": 1, "total_cache": 0, "total_in": 8175, "total_out": 6169, "total_reasoning_out": 0}, "ts": "2026-09-15T18:05:06Z"}
{"decision": {"change": "baseline", "component": "orchestration", "gain_pct": null, "kind": "baseline", "operation_kind": "baseline", "outcome": "REVERT", "task_id": "9d87461af4dc4507ad5113521d67e7e8"}, "phase": "PRELUDE", "tick": 7, "tokens": {"by_component": {"critic": {"calls": 1, "total_cache_creation": 0, "total_cache_read": 4800, "total_in": 2979, "total_out": 2587, "total_reasoning_out": 0}}, "calls": 1, "total_cache": 4800, "total_in": 2979, "total_out": 2587, "total_reasoning_out": 0}, "ts": "2026-09-15T18:08:25Z"}
{"decision": {"change": "specialist", "component": "orchestration", "gain_pct": null, "kind": "other", "operation_kind": "other", "outcome": "KEEP", "task_id": "8628519056b24176b3fa5c9a0e106dd6"}, "phase": "PRELUDE", "tick": 8, "tokens": {"by_component": {"specialist": {"calls": 100, "total_cache_creation": 0, "total_cache_read": 0, "total_in": 0, "total_out": 278974, "total_reasoning_out": 0}}, "calls": 100, "total_cache": 0, "total_in": 0, "total_out": 278974, "total_reasoning_out": 0}, "ts": "2026-09-15T19:00:59Z"}
{"decision": {"change": "recover", "component": "orchestration", "gain_pct": null, "kind": "other", "operation_kind": "other", "outcome": "KEEP", "task_id": "83c540f310134d568a451c79fb68beec"}, "phase": "PRELUDE", "tick": 8, "tokens": {"by_component": {}, "calls": 0, "total_cache": 0, "total_in": 0, "total_out": 0, "total_reasoning_out": 0}, "ts": "2026-09-15T19:01:04Z"}
{"decision": {"change": "integrate_patch", "component": "orchestration", "gain_pct": null, "kind": "other", "operation_kind": "other", "outcome": "no_promote", "task_id": "4618265478bb4dac9ba78741a436359b"}, "phase": "PRELUDE", "tick": 9, "tokens": {"by_component": {"critic": {"calls": 1, "total_cache_creation": 0, "total_cache_read": 0, "total_in": 8301, "total_out": 8110, "total_reasoning_out": 0}}, "calls": 1, "total_cache": 0, "total_in": 8301, "total_out": 8110, "total_reasoning_out": 0}, "ts": "2026-09-15T19:03:46Z"}
{"decision": {"change": "baseline", "component": "orchestration", "gain_pct": null, "kind": "baseline", "operation_kind": "baseline", "outcome": "REVERT", "task_id": "1d343fd9cc0643eda773d9a19a1f7ac2"}, "phase": "PRELUDE", "tick": 10, "tokens": {"by_component": {"critic": {"calls": 1, "total_cache_creation": 0, "total_cache_read": 4800, "total_in": 2985, "total_out": 4521, "total_reasoning_out": 0}}, "calls": 1, "total_cache": 4800, "total_in": 2985, "total_out": 4521, "total_reasoning_out": 0}, "ts": "2026-09-15T19:12:24Z"}
