{"decision": {"change": "target_analysis", "component": "orchestration", "gain_pct": null, "kind": "other", "operation_kind": "other", "outcome": "KEEP", "task_id": "c640a9ee30214d9b865dc9314daddf6b"}, "phase": "PRELUDE", "tick": 1, "tokens": {"by_component": {}, "calls": 0, "total_cache": 0, "total_in": 0, "total_out": 0, "total_reasoning_out": 0}, "ts": "2026-09-14T13:49:44Z"}
{"decision": {"change": "baseline", "component": "orchestration", "gain_pct": null, "kind": "baseline", "operation_kind": "baseline", "outcome": "REVERT", "task_id": "2fc18296cb5e4f75846d0f0dbf143c2b"}, "phase": "PRELUDE", "tick": 1, "tokens": {"by_component": {}, "calls": 0, "total_cache": 0, "total_in": 0, "total_out": 0, "total_reasoning_out": 0}, "ts": "2026-09-14T13:50:28Z"}
{"decision": {"change": "specialist", "component": "orchestration", "gain_pct": null, "kind": "other", "operation_kind": "other", "outcome": "KEEP", "task_id": "b8dc969b654d45e2a1e07acf784a2a4e"}, "phase": "PRELUDE", "tick": 4, "tokens": {"by_component": {"specialist": {"calls": 120, "total_cache_creation": 0, "total_cache_read": 0, "total_in": 0, "total_out": 0, "total_reasoning_out": 0}}, "calls": 120, "total_cache": 0, "total_in": 0, "total_out": 0, "total_reasoning_out": 0}, "ts": "2026-09-14T15:08:24Z"}
{"decision": {"change": "integrate_patch", "component": "orchestration", "gain_pct": null, "kind": "other", "operation_kind": "other", "outcome": "no_promote", "task_id": "90f715c0f2ee4a75af0baf5090deda13"}, "phase": "PRELUDE", "tick": 5, "tokens": {"by_component": {"critic": {"calls": 1, "total_cache_creation": 0, "total_cache_read": 0, "total_in": 7926, "total_out": 4479, "total_reasoning_out": 0}}, "calls": 1, "total_cache": 0, "total_in": 7926, "total_out": 4479, "total_reasoning_out": 0}, "ts": "2026-09-14T15:13:22Z"}
{"decision": {"change": "baseline", "component": "orchestration", "gain_pct": null, "kind": "baseline", "operation_kind": "baseline", "outcome": "REVERT", "task_id": "48e0ae2b0af74c03b4b40c847fc99d3b"}, "phase": "PRELUDE", "tick": 6, "tokens": {"by_component": {"critic": {"calls": 1, "total_cache_creation": 0, "total_cache_read": 4800, "total_in": 2898, "total_out": 2922, "total_reasoning_out": 0}}, "calls": 1, "total_cache": 4800, "total_in": 2898, "total_out": 2922, "total_reasoning_out": 0}, "ts": "2026-09-14T15:14:24Z"}
{"decision": {"change": "specialist", "component": "orchestration", "gain_pct": null, "kind": "other", "operation_kind": "other", "outcome": "KEEP", "task_id": "30ccc757c22d476390bae0873bfa153b"}, "phase": "PRELUDE", "tick": 7, "tokens": {"by_component": {"specialist": {"calls": 65, "total_cache_creation": 0, "total_cache_read": 0, "total_in": 0, "total_out": 0, "total_reasoning_out": 0}}, "calls": 65, "total_cache": 0, "total_in": 0, "total_out": 0, "total_reasoning_out": 0}, "ts": "2026-09-14T15:45:43Z"}
{"decision": {"change": "integrate_patch", "component": "orchestration", "gain_pct": null, "kind": "other", "operation_kind": "other", "outcome": "no_promote", "task_id": "34d103b9030d45bca38b9c671b5a2add"}, "phase": "PRELUDE", "tick": 8, "tokens": {"by_component": {"critic": {"calls": 1, "total_cache_creation": 0, "total_cache_read": 0, "total_in": 8133, "total_out": 6060, "total_reasoning_out": 0}}, "calls": 1, "total_cache": 0, "total_in": 8133, "total_out": 6060, "total_reasoning_out": 0}, "ts": "2026-09-14T15:50:39Z"}
{"decision": {"change": "baseline", "component": "orchestration", "gain_pct": null, "kind": "baseline", "operation_kind": "baseline", "outcome": "REVERT", "task_id": "0668d71b42d54c559c36634e823a55a5"}, "phase": "PRELUDE", "tick": 9, "tokens": {"by_component": {"critic": {"calls": 1, "total_cache_creation": 0, "total_cache_read": 4800, "total_in": 2924, "total_out": 1298, "total_reasoning_out": 0}}, "calls": 1, "total_cache": 4800, "total_in": 2924, "total_out": 1298, "total_reasoning_out": 0}, "ts": "2026-09-14T15:52:29Z"}
{"decision": {"change": "specialist", "component": "orchestration", "gain_pct": null, "kind": "other", "operation_kind": "other", "outcome": "KEEP", "task_id": "4633d7725f7b45148bdc2e3905cd54db"}, "phase": "PRELUDE", "tick": 11, "tokens": {"by_component": {"specialist": {"calls": 94, "total_cache_creation": 0, "total_cache_read": 0, "total_in": 0, "total_out": 0, "total_reasoning_out": 0}}, "calls": 94, "total_cache": 0, "total_in": 0, "total_out": 0, "total_reasoning_out": 0}, "ts": "2026-09-14T16:42:26Z"}
