{"decision": {"change": "target_analysis", "component": "orchestration", "gain_pct": null, "kind": "other", "operation_kind": "other", "outcome": "KEEP", "task_id": "cdd93b7c1663428e809f85b96de5282f"}, "phase": "PRELUDE", "tick": 1, "tokens": {"by_component": {}, "calls": 0, "total_cache": 0, "total_in": 0, "total_out": 0, "total_reasoning_out": 0}, "ts": "2026-09-14T09:50:25Z"}
{"decision": {"change": "baseline", "component": "orchestration", "gain_pct": null, "kind": "baseline", "operation_kind": "baseline", "outcome": "REVERT", "task_id": "cd3d94f7ca294c10aaccfa48beae0663"}, "phase": "PRELUDE", "tick": 1, "tokens": {"by_component": {}, "calls": 0, "total_cache": 0, "total_in": 0, "total_out": 0, "total_reasoning_out": 0}, "ts": "2026-09-14T09:50:55Z"}
{"decision": {"change": "target_analysis", "component": "orchestration", "gain_pct": null, "kind": "other", "operation_kind": "other", "outcome": "KEEP", "task_id": "1dece27bc62c417bb1720e63ff469c16"}, "phase": "PRELUDE", "tick": 9, "tokens": {"by_component": {"critic": {"calls": 1, "total_cache_creation": 0, "total_cache_read": 0, "total_in": 7781, "total_out": 1509, "total_reasoning_out": 0}}, "calls": 1, "total_cache": 0, "total_in": 7781, "total_out": 1509, "total_reasoning_out": 0}, "ts": "2026-09-14T10:23:18Z"}
{"decision": {"change": "target_analysis", "component": "orchestration", "gain_pct": null, "kind": "other", "operation_kind": "other", "outcome": "KEEP", "task_id": "5a61f556f30e4f858d3d24c75ebba0eb"}, "phase": "PRELUDE", "tick": 53, "tokens": {"by_component": {"critic": {"calls": 1, "total_cache_creation": 0, "total_cache_read": 0, "total_in": 7833, "total_out": 1560, "total_reasoning_out": 0}}, "calls": 1, "total_cache": 0, "total_in": 7833, "total_out": 1560, "total_reasoning_out": 0}, "ts": "2026-09-14T10:37:19Z"}
{"decision": {"change": "specialist", "component": "orchestration", "gain_pct": null, "kind": "other", "operation_kind": "other", "outcome": "KEEP", "task_id": "d00cdedfc173451eaf5b312d08e00da9"}, "phase": "PRELUDE", "tick": 145, "tokens": {"by_component": {"specialist": {"calls": 119, "total_cache_creation": 0, "total_cache_read": 0, "total_in": 0, "total_out": 167566, "total_reasoning_out": 0}}, "calls": 119, "total_cache": 0, "total_in": 0, "total_out": 167566, "total_reasoning_out": 0}, "ts": "2026-09-14T11:47:08Z"}
{"decision": {"change": "integrate_patch", "component": "orchestration", "gain_pct": null, "kind": "other", "operation_kind": "other", "outcome": "no_promote", "task_id": "7eb609d6de134d5c909251e89027ebbc"}, "phase": "PRELUDE", "tick": 146, "tokens": {"by_component": {"critic": {"calls": 1, "total_cache_creation": 0, "total_cache_read": 0, "total_in": 8017, "total_out": 8676, "total_reasoning_out": 0}}, "calls": 1, "total_cache": 0, "total_in": 8017, "total_out": 8676, "total_reasoning_out": 0}, "ts": "2026-09-14T11:48:59Z"}
{"decision": {"change": "baseline", "component": "orchestration", "gain_pct": null, "kind": "baseline", "operation_kind": "baseline", "outcome": "REVERT", "task_id": "3f5caae8b8034e6094faa0c559cdf087"}, "phase": "PRELUDE", "tick": 147, "tokens": {"by_component": {"critic": {"calls": 1, "total_cache_creation": 0, "total_cache_read": 4800, "total_in": 3101, "total_out": 1924, "total_reasoning_out": 0}}, "calls": 1, "total_cache": 4800, "total_in": 3101, "total_out": 1924, "total_reasoning_out": 0}, "ts": "2026-09-14T11:49:46Z"}
{"decision": {"change": "specialist", "component": "orchestration", "gain_pct": null, "kind": "other", "operation_kind": "other", "outcome": "KEEP", "task_id": "3bbb58e289654e3bb358a8db44343c2f"}, "phase": "PRELUDE", "tick": 148, "tokens": {"by_component": {"specialist": {"calls": 124, "total_cache_creation": 0, "total_cache_read": 0, "total_in": 0, "total_out": 260410, "total_reasoning_out": 0}}, "calls": 124, "total_cache": 0, "total_in": 0, "total_out": 260410, "total_reasoning_out": 0}, "ts": "2026-09-14T12:42:35Z"}
