{"decision": {"change": "target_analysis", "component": "orchestration", "gain_pct": null, "kind": "other", "operation_kind": "other", "outcome": "KEEP", "task_id": "85459fbdfe84459e820851c615b0f3f2"}, "phase": "PRELUDE", "tick": 1, "tokens": {"by_component": {}, "calls": 0, "total_cache": 0, "total_in": 0, "total_out": 0, "total_reasoning_out": 0}, "ts": "2026-09-15T10:34:39Z"}
{"decision": {"change": "baseline", "component": "orchestration", "gain_pct": null, "kind": "baseline", "operation_kind": "baseline", "outcome": "KEEP", "task_id": "51ac28ff8aed4ad59746fdb889fae7bb"}, "phase": "PRELUDE", "tick": 1, "tokens": {"by_component": {}, "calls": 0, "total_cache": 0, "total_in": 0, "total_out": 0, "total_reasoning_out": 0}, "ts": "2026-09-15T11:30:27Z"}
{"decision": {"change": "specialist", "component": "orchestration", "gain_pct": null, "kind": "other", "operation_kind": "other", "outcome": "KEEP", "task_id": "1def77a58ba3442fab227dc10d7173da"}, "phase": "PRELUDE", "tick": 1, "tokens": {"by_component": {"specialist": {"calls": 15, "total_cache_creation": 0, "total_cache_read": 0, "total_in": 0, "total_out": 0, "total_reasoning_out": 0}}, "calls": 15, "total_cache": 0, "total_in": 0, "total_out": 0, "total_reasoning_out": 0}, "ts": "2026-09-15T11:39:14Z"}
{"decision": {"change": "specialist", "component": "orchestration", "gain_pct": null, "kind": "other", "operation_kind": "other", "outcome": "KEEP", "task_id": "cbbcf3bf913b4e078871570f5c28adff"}, "phase": "PRELUDE", "tick": 1, "tokens": {"by_component": {"specialist": {"calls": 36, "total_cache_creation": 0, "total_cache_read": 0, "total_in": 0, "total_out": 42506, "total_reasoning_out": 0}}, "calls": 36, "total_cache": 0, "total_in": 0, "total_out": 42506, "total_reasoning_out": 0}, "ts": "2026-09-15T11:40:11Z"}
{"decision": {"change": "explore", "component": "orchestration", "gain_pct": 0.0, "kind": "other", "operation_kind": "other", "outcome": "REVERT", "task_id": "8057120570b44c71be84f1c1c1796a33"}, "phase": "FRAMEWORK_AGENT", "tick": 2, "tokens": {"by_component": {}, "calls": 0, "total_cache": 0, "total_in": 0, "total_out": 0, "total_reasoning_out": 0}, "ts": "2026-09-15T11:41:22Z"}
{"decision": {"change": "specialist", "component": "orchestration", "gain_pct": null, "kind": "other", "operation_kind": "other", "outcome": "KEEP", "task_id": "29596d2569b8440f8f7dfd64b072cc18"}, "phase": "FRAMEWORK_AGENT", "tick": 2, "tokens": {"by_component": {"specialist": {"calls": 22, "total_cache_creation": 0, "total_cache_read": 0, "total_in": 0, "total_out": 0, "total_reasoning_out": 0}}, "calls": 22, "total_cache": 0, "total_in": 0, "total_out": 0, "total_reasoning_out": 0}, "ts": "2026-09-15T11:48:13Z"}
{"decision": {"change": "specialist", "component": "orchestration", "gain_pct": null, "kind": "other", "operation_kind": "other", "outcome": "KEEP", "task_id": "aad01000e0044a3b88efb96d83848ae5"}, "phase": "FRAMEWORK_AGENT", "tick": 2, "tokens": {"by_component": {"specialist": {"calls": 28, "total_cache_creation": 0, "total_cache_read": 0, "total_in": 0, "total_out": 0, "total_reasoning_out": 0}}, "calls": 28, "total_cache": 0, "total_in": 0, "total_out": 0, "total_reasoning_out": 0}, "ts": "2026-09-15T12:01:14Z"}
{"decision": {"change": "specialist", "component": "orchestration", "gain_pct": null, "kind": "other", "operation_kind": "other", "outcome": "KEEP", "task_id": "f2b8d641528747c18b4c7c1509d0f7fa"}, "phase": "FRAMEWORK_AGENT", "tick": 2, "tokens": {"by_component": {"specialist": {"calls": 18, "total_cache_creation": 0, "total_cache_read": 0, "total_in": 0, "total_out": 0, "total_reasoning_out": 0}}, "calls": 18, "total_cache": 0, "total_in": 0, "total_out": 0, "total_reasoning_out": 0}, "ts": "2026-09-15T12:11:25Z"}
{"decision": {"change": "explore", "component": "orchestration", "gain_pct": 0.0, "kind": "other", "operation_kind": "other", "outcome": "REVERT", "task_id": "3343c902b850462faaf9ac8ade79c9c2"}, "phase": "FRAMEWORK_AGENT", "tick": 3, "tokens": {"by_component": {}, "calls": 0, "total_cache": 0, "total_in": 0, "total_out": 0, "total_reasoning_out": 0}, "ts": "2026-09-15T12:12:15Z"}
{"decision": {"change": "specialist", "component": "orchestration", "gain_pct": null, "kind": "other", "operation_kind": "other", "outcome": "KEEP", "task_id": "59a0b8a55f1a4aa989c15784913414fd"}, "phase": "FRAMEWORK_AGENT", "tick": 3, "tokens": {"by_component": {"specialist": {"calls": 44, "total_cache_creation": 0, "total_cache_read": 0, "total_in": 0, "total_out": 54519, "total_reasoning_out": 0}}, "calls": 44, "total_cache": 0, "total_in": 0, "total_out": 54519, "total_reasoning_out": 0}, "ts": "2026-09-15T12:19:54Z"}
{"decision": {"change": "explore", "component": "orchestration", "gain_pct": 0.0, "kind": "other", "operation_kind": "other", "outcome": "REVERT", "task_id": "9cb4f35b781e442faf026adb4d52ec4f"}, "phase": "FRAMEWORK_AGENT", "tick": 4, "tokens": {"by_component": {}, "calls": 0, "total_cache": 0, "total_in": 0, "total_out": 0, "total_reasoning_out": 0}, "ts": "2026-09-15T12:20:31Z"}
{"decision": {"change": "specialist", "component": "orchestration", "gain_pct": null, "kind": "other", "operation_kind": "other", "outcome": "KEEP", "task_id": "bdfa2a5a13b4422fa31439361d165510"}, "phase": "FRAMEWORK_AGENT", "tick": 4, "tokens": {"by_component": {"specialist": {"calls": 52, "total_cache_creation": 0, "total_cache_read": 0, "total_in": 0, "total_out": 0, "total_reasoning_out": 0}}, "calls": 52, "total_cache": 0, "total_in": 0, "total_out": 0, "total_reasoning_out": 0}, "ts": "2026-09-15T12:30:52Z"}
{"decision": {"change": "specialist", "component": "orchestration", "gain_pct": null, "kind": "other", "operation_kind": "other", "outcome": "KEEP", "task_id": "040d47bac9824e37a2183bd6880bda1c"}, "phase": "FRAMEWORK_AGENT", "tick": 5, "tokens": {"by_component": {"specialist": {"calls": 95, "total_cache_creation": 0, "total_cache_read": 0, "total_in": 0, "total_out": 259689, "total_reasoning_out": 0}}, "calls": 95, "total_cache": 0, "total_in": 0, "total_out": 259689, "total_reasoning_out": 0}, "ts": "2026-09-15T13:27:04Z"}
